{
  "$schema": "https://raw.githubusercontent.com/CanonFlow-Assay/CSharpAssay/main/eng/schemas/csassay.schema.json",
  "profile": "native",
  "release": {
    "allowPreviewToolchain": true,
    "requiredTargetFrameworks": [],
    "requiredRules": [],
    "tests": []
  },
  "boundaries": {
    "coreProjects": [],
    "shellProjects": [],
    "coreNamespaces": [],
    "shellNamespaces": []
  },
  "representations": {
    "resultTypes": [],
    "optionTypes": [],
    "closedTypes": []
  },
  "domainPrimitives": {},
  "suppressions": []
}
