{
  "$schema": "./eng/schemas/csassay.schema.json",
  "profile": "native",
  "release": {
    "allowPreviewToolchain": true,
    "requiredTargetFrameworks": [
      "net11.0"
    ],
    "requiredRules": [
      "CSAI0001",
      "CSAI0002",
      "CSAN0001",
      "CSAN0002",
      "CSAN0003",
      "CSAN0004",
      "CSAP0001"
    ],
    "tests": [
      {
        "input": "typegym/CsAssay.TypeGym/CsAssay.TypeGym.csproj",
        "configuration": "Release",
        "noBuild": false,
        "minimumExpectedTests": 18
      }
    ]
  },
  "boundaries": {
    "coreProjects": [
      "src/CsAssay.Domain/CsAssay.Domain.csproj",
      "src/CsAssay.Catalogue/CsAssay.Catalogue.csproj"
    ],
    "shellProjects": [
      "src/CsAssay.SdkAdapter/CsAssay.SdkAdapter.csproj",
      "src/CsAssay.Analyzers/CsAssay.Analyzers.csproj",
      "src/CsAssay.CodeFixes/CsAssay.CodeFixes.csproj",
      "src/CsAssay.Workspaces/CsAssay.Workspaces.csproj",
      "src/CsAssay.Reporting/CsAssay.Reporting.csproj",
      "src/CsAssay.Runner/CsAssay.Runner.csproj",
      "tests/CsAssay.Domain.Tests/CsAssay.Domain.Tests.csproj",
      "tests/CsAssay.Analyzers.Tests/CsAssay.Analyzers.Tests.csproj",
      "tests/CsAssay.Workspaces.Tests/CsAssay.Workspaces.Tests.csproj",
      "tests/CsAssay.Runner.Tests/CsAssay.Runner.Tests.csproj",
      "tests/CsAssay.Integration.Tests/CsAssay.Integration.Tests.csproj",
      "tests/CsAssay.Performance.Tests/CsAssay.Performance.Tests.csproj",
      "typegym/CsAssay.TypeGym/CsAssay.TypeGym.csproj",
      "eng/CsAssay.PackageAudit/CsAssay.PackageAudit.csproj",
      "eng/CsAssay.Qualification/CsAssay.Qualification.csproj"
    ],
    "coreNamespaces": [
      "CsAssay.Domain",
      "CsAssay.Catalogue"
    ],
    "shellNamespaces": [
      "CsAssay.SdkAdapter",
      "CsAssay.Analyzers",
      "CsAssay.Workspaces",
      "CsAssay.Reporting",
      "CsAssay.Runner",
      "CsAssay.Domain.Tests",
      "CsAssay.TypeGym"
    ]
  },
  "representations": {
    "resultTypes": [],
    "optionTypes": [],
    "closedTypes": []
  },
  "domainPrimitives": {},
  "suppressions": []
}
