{
  "$schema": "https://raw.githubusercontent.com/CanonFlow-Assay/CSharpAssay/main/eng/schemas/csassay.schema.json",
  "profile": "native",
  "release": {
    "allowPreviewToolchain": true,
    "requiredTargetFrameworks": ["net11.0"],
    "requiredRules": [
      "CSAI0001",
      "CSAI0002",
      "CSAN0001",
      "CSAN0002",
      "CSAN0003",
      "CSAN0004",
      "CSAP0001"
    ],
    "tests": [
      {
        "input": "tests/Acme.Tests/Acme.Tests.csproj",
        "configuration": "Release",
        "noBuild": false,
        "minimumExpectedTests": 1
      }
    ]
  },
  "boundaries": {
    "coreProjects": ["src/Acme.Domain/Acme.Domain.csproj"],
    "shellProjects": ["src/Acme.Web/Acme.Web.csproj"],
    "coreNamespaces": ["Acme.Domain"],
    "shellNamespaces": ["Acme.Web"]
  },
  "representations": {
    "resultTypes": [],
    "optionTypes": [],
    "closedTypes": []
  },
  "domainPrimitives": {
    "Acme.Domain.CustomerId": ["customerId"]
  },
  "suppressions": []
}
